Frame 1: 88 bytes on wire (704 bits), 88 bytes captured (704 bits)
    Encapsulation type: NULL (15)
    Arrival Time: Mar 23, 2015 12:30:06.822499000 CET
    [Time shift for this packet: 0.000000000 seconds]
    Epoch Time: 1427110206.822499000 seconds
    [Time delta from previous captured frame: 0.000000000 seconds]
    [Time delta from previous displayed frame: 0.000000000 seconds]
    [Time since reference or first frame: 0.000000000 seconds]
    Frame Number: 1
    Frame Length: 88 bytes (704 bits)
    Capture Length: 88 bytes (704 bits)
    [Frame is marked: False]
    [Frame is ignored: False]
    [Protocols in frame: null:ipv6:ipv6.nxt:tcp]
Null/Loopback
    Family: IPv6 (30)
Internet Protocol Version 6, Src: ::1 (::1), Dst: ::1 (::1)
    0110 .... = Version: 6
        [0110 .... = This field makes the filter "ip.version == 6" possible: 6]
    .... 0000 0000 .... .... .... .... .... = Traffic class: 0x00000000
        .... 0000 00.. .... .... .... .... .... = Differentiated Services Field: Default (0x00000000)
        .... .... ..0. .... .... .... .... .... = ECN-Capable Transport (ECT): Not set
        .... .... ...0 .... .... .... .... .... = ECN-CE: Not set
    .... .... .... 0101 1101 0010 0011 0010 = Flowlabel: 0x0005d232
    Payload length: 44
    Next header: TCP (6)
    Hop limit: 64
    Source: ::1 (::1)
    Destination: ::1 (::1)
    [Source GeoIP: Unknown]
    [Destination GeoIP: Unknown]
Transmission Control Protocol, Src Port: 61119 (61119), Dst Port: 22 (22), Seq: 0, Len: 0
    Source Port: 61119 (61119)
    Destination Port: 22 (22)
    [Stream index: 0]
    [TCP Segment Len: 0]
    Sequence number: 0    (relative sequence number)
    Acknowledgment number: 0
    Header Length: 44 bytes
    .... 0000 0000 0010 = Flags: 0x002 (SYN)
        000. .... .... = Reserved: Not set
        ...0 .... .... = Nonce: Not set
        .... 0... .... = Congestion Window Reduced (CWR): Not set
        .... .0.. .... = ECN-Echo: Not set
        .... ..0. .... = Urgent: Not set
        .... ...0 .... = Acknowledgment: Not set
        .... .... 0... = Push: Not set
        .... .... .0.. = Reset: Not set
        .... .... ..1. = Syn: Set
            [Expert Info (Chat/Sequence): Connection establish request (SYN): server port 22]
                [Connection establish request (SYN): server port 22]
                [Severity level: Chat]
                [Group: Sequence]
        .... .... ...0 = Fin: Not set
    Window size value: 65535
    [Calculated window size: 65535]
    Checksum: 0x0034 [validation disabled]
        [Good Checksum: False]
        [Bad Checksum: False]
    Urgent pointer: 0
    Options: (24 bytes), Maximum segment size, No-Operation (NOP), Window scale, No-Operation (NOP), No-Operation (NOP), Timestamps, SACK permitted, End of Option List (EOL)
        Maximum segment size: 16324 bytes
            Kind: Maximum Segment Size (2)
            Length: 4
            MSS Value: 16324
        No-Operation (NOP)
            Type: 1
                0... .... = Copy on fragmentation: No
                .00. .... = Class: Control (0)
                ...0 0001 = Number: No-Operation (NOP) (1)
        Window scale: 5 (multiply by 32)
            Kind: Window Scale (3)
            Length: 3
            Shift count: 5
            [Multiplier: 32]
        No-Operation (NOP)
            Type: 1
                0... .... = Copy on fragmentation: No
                .00. .... = Class: Control (0)
                ...0 0001 = Number: No-Operation (NOP) (1)
        No-Operation (NOP)
            Type: 1
                0... .... = Copy on fragmentation: No
                .00. .... = Class: Control (0)
                ...0 0001 = Number: No-Operation (NOP) (1)
        Timestamps: TSval 195512248, TSecr 0
            Kind: Time Stamp Option (8)
            Length: 10
            Timestamp value: 195512248
            Timestamp echo reply: 0
        TCP SACK Permitted Option: True
            Kind: SACK Permitted (4)
            Length: 2
        End of Option List (EOL)
            Type: 0
                0... .... = Copy on fragmentation: No
                .00. .... = Class: Control (0)
                ...0 0000 = Number: End of Option List (EOL) (0)

Frame 2: 88 bytes on wire (704 bits), 88 bytes captured (704 bits)
    Encapsulation type: NULL (15)
    Arrival Time: Mar 23, 2015 12:30:06.822595000 CET
    [Time shift for this packet: 0.000000000 seconds]
    Epoch Time: 1427110206.822595000 seconds
    [Time delta from previous captured frame: 0.000096000 seconds]
    [Time delta from previous displayed frame: 0.000096000 seconds]
    [Time since reference or first frame: 0.000096000 seconds]
    Frame Number: 2
    Frame Length: 88 bytes (704 bits)
    Capture Length: 88 bytes (704 bits)
    [Frame is marked: False]
    [Frame is ignored: False]
    [Protocols in frame: null:ipv6:ipv6.nxt:tcp]
Null/Loopback
    Family: IPv6 (30)
Internet Protocol Version 6, Src: ::1 (::1), Dst: ::1 (::1)
    0110 .... = Version: 6
        [0110 .... = This field makes the filter "ip.version == 6" possible: 6]
    .... 0000 0000 .... .... .... .... .... = Traffic class: 0x00000000
        .... 0000 00.. .... .... .... .... .... = Differentiated Services Field: Default (0x00000000)
        .... .... ..0. .... .... .... .... .... = ECN-Capable Transport (ECT): Not set
        .... .... ...0 .... .... .... .... .... = ECN-CE: Not set
    .... .... .... 0111 1010 0101 0011 1101 = Flowlabel: 0x0007a53d
    Payload length: 44
    Next header: TCP (6)
    Hop limit: 64
    Source: ::1 (::1)
    Destination: ::1 (::1)
    [Source GeoIP: Unknown]
    [Destination GeoIP: Unknown]
Transmission Control Protocol, Src Port: 22 (22), Dst Port: 61119 (61119), Seq: 0, Ack: 1, Len: 0
    Source Port: 22 (22)
    Destination Port: 61119 (61119)
    [Stream index: 0]
    [TCP Segment Len: 0]
    Sequence number: 0    (relative sequence number)
    Acknowledgment number: 1    (relative ack number)
    Header Length: 44 bytes
    .... 0000 0001 0010 = Flags: 0x012 (SYN, ACK)
        000. .... .... = Reserved: Not set
        ...0 .... .... = Nonce: Not set
        .... 0... .... = Congestion Window Reduced (CWR): Not set
        .... .0.. .... = ECN-Echo: Not set
        .... ..0. .... = Urgent: Not set
        .... ...1 .... = Acknowledgment: Set
        .... .... 0... = Push: Not set
        .... .... .0.. = Reset: Not set
        .... .... ..1. = Syn: Set
            [Expert Info (Chat/Sequence): Connection establish acknowledge (SYN+ACK): server port 22]
                [Connection establish acknowledge (SYN+ACK): server port 22]
                [Severity level: Chat]
                [Group: Sequence]
        .... .... ...0 = Fin: Not set
    Window size value: 65535
    [Calculated window size: 65535]
    Checksum: 0x0034 [validation disabled]
        [Good Checksum: False]
        [Bad Checksum: False]
    Urgent pointer: 0
    Options: (24 bytes), Maximum segment size, No-Operation (NOP), Window scale, No-Operation (NOP), No-Operation (NOP), Timestamps, SACK permitted, End of Option List (EOL)
        Maximum segment size: 16324 bytes
            Kind: Maximum Segment Size (2)
            Length: 4
            MSS Value: 16324
        No-Operation (NOP)
            Type: 1
                0... .... = Copy on fragmentation: No
                .00. .... = Class: Control (0)
                ...0 0001 = Number: No-Operation (NOP) (1)
        Window scale: 5 (multiply by 32)
            Kind: Window Scale (3)
            Length: 3
            Shift count: 5
            [Multiplier: 32]
        No-Operation (NOP)
            Type: 1
                0... .... = Copy on fragmentation: No
                .00. .... = Class: Control (0)
                ...0 0001 = Number: No-Operation (NOP) (1)
        No-Operation (NOP)
            Type: 1
                0... .... = Copy on fragmentation: No
                .00. .... = Class: Control (0)
                ...0 0001 = Number: No-Operation (NOP) (1)
        Timestamps: TSval 195512248, TSecr 195512248
            Kind: Time Stamp Option (8)
            Length: 10
            Timestamp value: 195512248
            Timestamp echo reply: 195512248
        TCP SACK Permitted Option: True
            Kind: SACK Permitted (4)
            Length: 2
        End of Option List (EOL)
            Type: 0
                0... .... = Copy on fragmentation: No
                .00. .... = Class: Control (0)
                ...0 0000 = Number: End of Option List (EOL) (0)
    [SEQ/ACK analysis]
        [This is an ACK to the segment in frame: 1]
        [The RTT to ACK the segment was: 0.000096000 seconds]

Frame 3: 76 bytes on wire (608 bits), 76 bytes captured (608 bits)
    Encapsulation type: NULL (15)
    Arrival Time: Mar 23, 2015 12:30:06.822612000 CET
    [Time shift for this packet: 0.000000000 seconds]
    Epoch Time: 1427110206.822612000 seconds
    [Time delta from previous captured frame: 0.000017000 seconds]
    [Time delta from previous displayed frame: 0.000017000 seconds]
    [Time since reference or first frame: 0.000113000 seconds]
    Frame Number: 3
    Frame Length: 76 bytes (608 bits)
    Capture Length: 76 bytes (608 bits)
    [Frame is marked: False]
    [Frame is ignored: False]
    [Protocols in frame: null:ipv6:ipv6.nxt:tcp]
Null/Loopback
    Family: IPv6 (30)
Internet Protocol Version 6, Src: ::1 (::1), Dst: ::1 (::1)
    0110 .... = Version: 6
        [0110 .... = This field makes the filter "ip.version == 6" possible: 6]
    .... 0000 0000 .... .... .... .... .... = Traffic class: 0x00000000
        .... 0000 00.. .... .... .... .... .... = Differentiated Services Field: Default (0x00000000)
        .... .... ..0. .... .... .... .... .... = ECN-Capable Transport (ECT): Not set
        .... .... ...0 .... .... .... .... .... = ECN-CE: Not set
    .... .... .... 0101 1101 0010 0011 0010 = Flowlabel: 0x0005d232
    Payload length: 32
    Next header: TCP (6)
    Hop limit: 64
    Source: ::1 (::1)
    Destination: ::1 (::1)
    [Source GeoIP: Unknown]
    [Destination GeoIP: Unknown]
Transmission Control Protocol, Src Port: 61119 (61119), Dst Port: 22 (22), Seq: 1, Ack: 1, Len: 0
    Source Port: 61119 (61119)
    Destination Port: 22 (22)
    [Stream index: 0]
    [TCP Segment Len: 0]
    Sequence number: 1    (relative sequence number)
    Acknowledgment number: 1    (relative ack number)
    Header Length: 32 bytes
    .... 0000 0001 0000 = Flags: 0x010 (ACK)
        000. .... .... = Reserved: Not set
        ...0 .... .... = Nonce: Not set
        .... 0... .... = Congestion Window Reduced (CWR): Not set
        .... .0.. .... = ECN-Echo: Not set
        .... ..0. .... = Urgent: Not set
        .... ...1 .... = Acknowledgment: Set
        .... .... 0... = Push: Not set
        .... .... .0.. = Reset: Not set
        .... .... ..0. = Syn: Not set
        .... .... ...0 = Fin: Not set
    Window size value: 12743
    [Calculated window size: 407776]
    [Window size scaling factor: 32]
    Checksum: 0x0028 [validation disabled]
        [Good Checksum: False]
        [Bad Checksum: False]
    Urgent pointer: 0
    Options: (12 bytes), No-Operation (NOP), No-Operation (NOP), Timestamps
        No-Operation (NOP)
            Type: 1
                0... .... = Copy on fragmentation: No
                .00. .... = Class: Control (0)
                ...0 0001 = Number: No-Operation (NOP) (1)
        No-Operation (NOP)
            Type: 1
                0... .... = Copy on fragmentation: No
                .00. .... = Class: Control (0)
                ...0 0001 = Number: No-Operation (NOP) (1)
        Timestamps: TSval 195512248, TSecr 195512248
            Kind: Time Stamp Option (8)
            Length: 10
            Timestamp value: 195512248
            Timestamp echo reply: 195512248
    [SEQ/ACK analysis]
        [This is an ACK to the segment in frame: 2]
        [The RTT to ACK the segment was: 0.000017000 seconds]
        [iRTT: 0.000113000 seconds]

Frame 4: 76 bytes on wire (608 bits), 76 bytes captured (608 bits)
    Encapsulation type: NULL (15)
    Arrival Time: Mar 23, 2015 12:30:06.822626000 CET
    [Time shift for this packet: 0.000000000 seconds]
    Epoch Time: 1427110206.822626000 seconds
    [Time delta from previous captured frame: 0.000014000 seconds]
    [Time delta from previous displayed frame: 0.000014000 seconds]
    [Time since reference or first frame: 0.000127000 seconds]
    Frame Number: 4
    Frame Length: 76 bytes (608 bits)
    Capture Length: 76 bytes (608 bits)
    [Frame is marked: False]
    [Frame is ignored: False]
    [Protocols in frame: null:ipv6:ipv6.nxt:tcp]
Null/Loopback
    Family: IPv6 (30)
Internet Protocol Version 6, Src: ::1 (::1), Dst: ::1 (::1)
    0110 .... = Version: 6
        [0110 .... = This field makes the filter "ip.version == 6" possible: 6]
    .... 0000 0000 .... .... .... .... .... = Traffic class: 0x00000000
        .... 0000 00.. .... .... .... .... .... = Differentiated Services Field: Default (0x00000000)
        .... .... ..0. .... .... .... .... .... = ECN-Capable Transport (ECT): Not set
        .... .... ...0 .... .... .... .... .... = ECN-CE: Not set
    .... .... .... 0111 1010 0101 0011 1101 = Flowlabel: 0x0007a53d
    Payload length: 32
    Next header: TCP (6)
    Hop limit: 64
    Source: ::1 (::1)
    Destination: ::1 (::1)
    [Source GeoIP: Unknown]
    [Destination GeoIP: Unknown]
Transmission Control Protocol, Src Port: 22 (22), Dst Port: 61119 (61119), Seq: 1, Ack: 1, Len: 0
    Source Port: 22 (22)
    Destination Port: 61119 (61119)
    [Stream index: 0]
    [TCP Segment Len: 0]
    Sequence number: 1    (relative sequence number)
    Acknowledgment number: 1    (relative ack number)
    Header Length: 32 bytes
    .... 0000 0001 0000 = Flags: 0x010 (ACK)
        000. .... .... = Reserved: Not set
        ...0 .... .... = Nonce: Not set
        .... 0... .... = Congestion Window Reduced (CWR): Not set
        .... .0.. .... = ECN-Echo: Not set
        .... ..0. .... = Urgent: Not set
        .... ...1 .... = Acknowledgment: Set
        .... .... 0... = Push: Not set
        .... .... .0.. = Reset: Not set
        .... .... ..0. = Syn: Not set
        .... .... ...0 = Fin: Not set
    Window size value: 12743
    [Calculated window size: 407776]
    [Window size scaling factor: 32]
    Checksum: 0x0028 [validation disabled]
        [Good Checksum: False]
        [Bad Checksum: False]
    Urgent pointer: 0
    Options: (12 bytes), No-Operation (NOP), No-Operation (NOP), Timestamps
        No-Operation (NOP)
            Type: 1
                0... .... = Copy on fragmentation: No
                .00. .... = Class: Control (0)
                ...0 0001 = Number: No-Operation (NOP) (1)
        No-Operation (NOP)
            Type: 1
                0... .... = Copy on fragmentation: No
                .00. .... = Class: Control (0)
                ...0 0001 = Number: No-Operation (NOP) (1)
        Timestamps: TSval 195512248, TSecr 195512248
            Kind: Time Stamp Option (8)
            Length: 10
            Timestamp value: 195512248
            Timestamp echo reply: 195512248
    [SEQ/ACK analysis]
        [iRTT: 0.000113000 seconds]
        [TCP Analysis Flags]
            [Expert Info (Chat/Sequence): TCP window update]
                [TCP window update]
                [Severity level: Chat]
                [Group: Sequence]

Frame 5: 97 bytes on wire (776 bits), 97 bytes captured (776 bits)
    Encapsulation type: NULL (15)
    Arrival Time: Mar 23, 2015 12:30:06.822958000 CET
    [Time shift for this packet: 0.000000000 seconds]
    Epoch Time: 1427110206.822958000 seconds
    [Time delta from previous captured frame: 0.000332000 seconds]
    [Time delta from previous displayed frame: 0.000332000 seconds]
    [Time since reference or first frame: 0.000459000 seconds]
    Frame Number: 5
    Frame Length: 97 bytes (776 bits)
    Capture Length: 97 bytes (776 bits)
    [Frame is marked: False]
    [Frame is ignored: False]
    [Protocols in frame: null:ipv6:ipv6.nxt:tcp:ssh]
Null/Loopback
    Family: IPv6 (30)
Internet Protocol Version 6, Src: ::1 (::1), Dst: ::1 (::1)
    0110 .... = Version: 6
        [0110 .... = This field makes the filter "ip.version == 6" possible: 6]
    .... 0000 0000 .... .... .... .... .... = Traffic class: 0x00000000
        .... 0000 00.. .... .... .... .... .... = Differentiated Services Field: Default (0x00000000)
        .... .... ..0. .... .... .... .... .... = ECN-Capable Transport (ECT): Not set
        .... .... ...0 .... .... .... .... .... = ECN-CE: Not set
    .... .... .... 0101 1101 0010 0011 0010 = Flowlabel: 0x0005d232
    Payload length: 53
    Next header: TCP (6)
    Hop limit: 64
    Source: ::1 (::1)
    Destination: ::1 (::1)
    [Source GeoIP: Unknown]
    [Destination GeoIP: Unknown]
Transmission Control Protocol, Src Port: 61119 (61119), Dst Port: 22 (22), Seq: 1, Ack: 1, Len: 21
    Source Port: 61119 (61119)
    Destination Port: 22 (22)
    [Stream index: 0]
    [TCP Segment Len: 21]
    Sequence number: 1    (relative sequence number)
    [Next sequence number: 22    (relative sequence number)]
    Acknowledgment number: 1    (relative ack number)
    Header Length: 32 bytes
    .... 0000 0001 1000 = Flags: 0x018 (PSH, ACK)
        000. .... .... = Reserved: Not set
        ...0 .... .... = Nonce: Not set
        .... 0... .... = Congestion Window Reduced (CWR): Not set
        .... .0.. .... = ECN-Echo: Not set
        .... ..0. .... = Urgent: Not set
        .... ...1 .... = Acknowledgment: Set
        .... .... 1... = Push: Set
        .... .... .0.. = Reset: Not set
        .... .... ..0. = Syn: Not set
        .... .... ...0 = Fin: Not set
    Window size value: 12743
    [Calculated window size: 407776]
    [Window size scaling factor: 32]
    Checksum: 0x003d [validation disabled]
        [Good Checksum: False]
        [Bad Checksum: False]
    Urgent pointer: 0
    Options: (12 bytes), No-Operation (NOP), No-Operation (NOP), Timestamps
        No-Operation (NOP)
            Type: 1
                0... .... = Copy on fragmentation: No
                .00. .... = Class: Control (0)
                ...0 0001 = Number: No-Operation (NOP) (1)
        No-Operation (NOP)
            Type: 1
                0... .... = Copy on fragmentation: No
                .00. .... = Class: Control (0)
                ...0 0001 = Number: No-Operation (NOP) (1)
        Timestamps: TSval 195512248, TSecr 195512248
            Kind: Time Stamp Option (8)
            Length: 10
            Timestamp value: 195512248
            Timestamp echo reply: 195512248
    [SEQ/ACK analysis]
        [iRTT: 0.000113000 seconds]
        [Bytes in flight: 21]
SSH Protocol
    Protocol: SSH-2.0-OpenSSH_6.2\r\n

Frame 6: 76 bytes on wire (608 bits), 76 bytes captured (608 bits)
    Encapsulation type: NULL (15)
    Arrival Time: Mar 23, 2015 12:30:06.822982000 CET
    [Time shift for this packet: 0.000000000 seconds]
    Epoch Time: 1427110206.822982000 seconds
    [Time delta from previous captured frame: 0.000024000 seconds]
    [Time delta from previous displayed frame: 0.000024000 seconds]
    [Time since reference or first frame: 0.000483000 seconds]
    Frame Number: 6
    Frame Length: 76 bytes (608 bits)
    Capture Length: 76 bytes (608 bits)
    [Frame is marked: False]
    [Frame is ignored: False]
    [Protocols in frame: null:ipv6:ipv6.nxt:tcp]
Null/Loopback
    Family: IPv6 (30)
Internet Protocol Version 6, Src: ::1 (::1), Dst: ::1 (::1)
    0110 .... = Version: 6
        [0110 .... = This field makes the filter "ip.version == 6" possible: 6]
    .... 0000 0000 .... .... .... .... .... = Traffic class: 0x00000000
        .... 0000 00.. .... .... .... .... .... = Differentiated Services Field: Default (0x00000000)
        .... .... ..0. .... .... .... .... .... = ECN-Capable Transport (ECT): Not set
        .... .... ...0 .... .... .... .... .... = ECN-CE: Not set
    .... .... .... 0111 1010 0101 0011 1101 = Flowlabel: 0x0007a53d
    Payload length: 32
    Next header: TCP (6)
    Hop limit: 64
    Source: ::1 (::1)
    Destination: ::1 (::1)
    [Source GeoIP: Unknown]
    [Destination GeoIP: Unknown]
Transmission Control Protocol, Src Port: 22 (22), Dst Port: 61119 (61119), Seq: 1, Ack: 22, Len: 0
    Source Port: 22 (22)
    Destination Port: 61119 (61119)
    [Stream index: 0]
    [TCP Segment Len: 0]
    Sequence number: 1    (relative sequence number)
    Acknowledgment number: 22    (relative ack number)
    Header Length: 32 bytes
    .... 0000 0001 0000 = Flags: 0x010 (ACK)
        000. .... .... = Reserved: Not set
        ...0 .... .... = Nonce: Not set
        .... 0... .... = Congestion Window Reduced (CWR): Not set
        .... .0.. .... = ECN-Echo: Not set
        .... ..0. .... = Urgent: Not set
        .... ...1 .... = Acknowledgment: Set
        .... .... 0... = Push: Not set
        .... .... .0.. = Reset: Not set
        .... .... ..0. = Syn: Not set
        .... .... ...0 = Fin: Not set
    Window size value: 12743
    [Calculated window size: 407776]
    [Window size scaling factor: 32]
    Checksum: 0x0028 [validation disabled]
        [Good Checksum: False]
        [Bad Checksum: False]
    Urgent pointer: 0
    Options: (12 bytes), No-Operation (NOP), No-Operation (NOP), Timestamps
        No-Operation (NOP)
            Type: 1
                0... .... = Copy on fragmentation: No
                .00. .... = Class: Control (0)
                ...0 0001 = Number: No-Operation (NOP) (1)
        No-Operation (NOP)
            Type: 1
                0... .... = Copy on fragmentation: No
                .00. .... = Class: Control (0)
                ...0 0001 = Number: No-Operation (NOP) (1)
        Timestamps: TSval 195512248, TSecr 195512248
            Kind: Time Stamp Option (8)
            Length: 10
            Timestamp value: 195512248
            Timestamp echo reply: 195512248
    [SEQ/ACK analysis]
        [This is an ACK to the segment in frame: 5]
        [The RTT to ACK the segment was: 0.000024000 seconds]
        [iRTT: 0.000113000 seconds]

Frame 7: 97 bytes on wire (776 bits), 97 bytes captured (776 bits)
    Encapsulation type: NULL (15)
    Arrival Time: Mar 23, 2015 12:30:06.838139000 CET
    [Time shift for this packet: 0.000000000 seconds]
    Epoch Time: 1427110206.838139000 seconds
    [Time delta from previous captured frame: 0.015157000 seconds]
    [Time delta from previous displayed frame: 0.015157000 seconds]
    [Time since reference or first frame: 0.015640000 seconds]
    Frame Number: 7
    Frame Length: 97 bytes (776 bits)
    Capture Length: 97 bytes (776 bits)
    [Frame is marked: False]
    [Frame is ignored: False]
    [Protocols in frame: null:ipv6:ipv6.nxt:tcp:ssh]
Null/Loopback
    Family: IPv6 (30)
Internet Protocol Version 6, Src: ::1 (::1), Dst: ::1 (::1)
    0110 .... = Version: 6
        [0110 .... = This field makes the filter "ip.version == 6" possible: 6]
    .... 0000 0000 .... .... .... .... .... = Traffic class: 0x00000000
        .... 0000 00.. .... .... .... .... .... = Differentiated Services Field: Default (0x00000000)
        .... .... ..0. .... .... .... .... .... = ECN-Capable Transport (ECT): Not set
        .... .... ...0 .... .... .... .... .... = ECN-CE: Not set
    .... .... .... 0111 1010 0101 0011 1101 = Flowlabel: 0x0007a53d
    Payload length: 53
    Next header: TCP (6)
    Hop limit: 64
    Source: ::1 (::1)
    Destination: ::1 (::1)
    [Source GeoIP: Unknown]
    [Destination GeoIP: Unknown]
Transmission Control Protocol, Src Port: 22 (22), Dst Port: 61119 (61119), Seq: 1, Ack: 22, Len: 21
    Source Port: 22 (22)
    Destination Port: 61119 (61119)
    [Stream index: 0]
    [TCP Segment Len: 21]
    Sequence number: 1    (relative sequence number)
    [Next sequence number: 22    (relative sequence number)]
    Acknowledgment number: 22    (relative ack number)
    Header Length: 32 bytes
    .... 0000 0001 1000 = Flags: 0x018 (PSH, ACK)
        000. .... .... = Reserved: Not set
        ...0 .... .... = Nonce: Not set
        .... 0... .... = Congestion Window Reduced (CWR): Not set
        .... .0.. .... = ECN-Echo: Not set
        .... ..0. .... = Urgent: Not set
        .... ...1 .... = Acknowledgment: Set
        .... .... 1... = Push: Set
        .... .... .0.. = Reset: Not set
        .... .... ..0. = Syn: Not set
        .... .... ...0 = Fin: Not set
    Window size value: 12743
    [Calculated window size: 407776]
    [Window size scaling factor: 32]
    Checksum: 0x003d [validation disabled]
        [Good Checksum: False]
        [Bad Checksum: False]
    Urgent pointer: 0
    Options: (12 bytes), No-Operation (NOP), No-Operation (NOP), Timestamps
        No-Operation (NOP)
            Type: 1
                0... .... = Copy on fragmentation: No
                .00. .... = Class: Control (0)
                ...0 0001 = Number: No-Operation (NOP) (1)
        No-Operation (NOP)
            Type: 1
                0... .... = Copy on fragmentation: No
                .00. .... = Class: Control (0)
                ...0 0001 = Number: No-Operation (NOP) (1)
        Timestamps: TSval 195512263, TSecr 195512248
            Kind: Time Stamp Option (8)
            Length: 10
            Timestamp value: 195512263
            Timestamp echo reply: 195512248
    [SEQ/ACK analysis]
        [iRTT: 0.000113000 seconds]
        [Bytes in flight: 21]
SSH Protocol
    Protocol: SSH-2.0-OpenSSH_6.2\r\n

Frame 8: 76 bytes on wire (608 bits), 76 bytes captured (608 bits)
    Encapsulation type: NULL (15)
    Arrival Time: Mar 23, 2015 12:30:06.838173000 CET
    [Time shift for this packet: 0.000000000 seconds]
    Epoch Time: 1427110206.838173000 seconds
    [Time delta from previous captured frame: 0.000034000 seconds]
    [Time delta from previous displayed frame: 0.000034000 seconds]
    [Time since reference or first frame: 0.015674000 seconds]
    Frame Number: 8
    Frame Length: 76 bytes (608 bits)
    Capture Length: 76 bytes (608 bits)
    [Frame is marked: False]
    [Frame is ignored: False]
    [Protocols in frame: null:ipv6:ipv6.nxt:tcp]
Null/Loopback
    Family: IPv6 (30)
Internet Protocol Version 6, Src: ::1 (::1), Dst: ::1 (::1)
    0110 .... = Version: 6
        [0110 .... = This field makes the filter "ip.version == 6" possible: 6]
    .... 0000 0000 .... .... .... .... .... = Traffic class: 0x00000000
        .... 0000 00.. .... .... .... .... .... = Differentiated Services Field: Default (0x00000000)
        .... .... ..0. .... .... .... .... .... = ECN-Capable Transport (ECT): Not set
        .... .... ...0 .... .... .... .... .... = ECN-CE: Not set
    .... .... .... 0101 1101 0010 0011 0010 = Flowlabel: 0x0005d232
    Payload length: 32
    Next header: TCP (6)
    Hop limit: 64
    Source: ::1 (::1)
    Destination: ::1 (::1)
    [Source GeoIP: Unknown]
    [Destination GeoIP: Unknown]
Transmission Control Protocol, Src Port: 61119 (61119), Dst Port: 22 (22), Seq: 22, Ack: 22, Len: 0
    Source Port: 61119 (61119)
    Destination Port: 22 (22)
    [Stream index: 0]
    [TCP Segment Len: 0]
    Sequence number: 22    (relative sequence number)
    Acknowledgment number: 22    (relative ack number)
    Header Length: 32 bytes
    .... 0000 0001 0000 = Flags: 0x010 (ACK)
        000. .... .... = Reserved: Not set
        ...0 .... .... = Nonce: Not set
        .... 0... .... = Congestion Window Reduced (CWR): Not set
        .... .0.. .... = ECN-Echo: Not set
        .... ..0. .... = Urgent: Not set
        .... ...1 .... = Acknowledgment: Set
        .... .... 0... = Push: Not set
        .... .... .0.. = Reset: Not set
        .... .... ..0. = Syn: Not set
        .... .... ...0 = Fin: Not set
    Window size value: 12743
    [Calculated window size: 407776]
    [Window size scaling factor: 32]
    Checksum: 0x0028 [validation disabled]
        [Good Checksum: False]
        [Bad Checksum: False]
    Urgent pointer: 0
    Options: (12 bytes), No-Operation (NOP), No-Operation (NOP), Timestamps
        No-Operation (NOP)
            Type: 1
                0... .... = Copy on fragmentation: No
                .00. .... = Class: Control (0)
                ...0 0001 = Number: No-Operation (NOP) (1)
        No-Operation (NOP)
            Type: 1
                0... .... = Copy on fragmentation: No
                .00. .... = Class: Control (0)
                ...0 0001 = Number: No-Operation (NOP) (1)
        Timestamps: TSval 195512263, TSecr 195512263
            Kind: Time Stamp Option (8)
            Length: 10
            Timestamp value: 195512263
            Timestamp echo reply: 195512263
    [SEQ/ACK analysis]
        [This is an ACK to the segment in frame: 7]
        [The RTT to ACK the segment was: 0.000034000 seconds]
        [iRTT: 0.000113000 seconds]

Frame 9: 1668 bytes on wire (13344 bits), 1668 bytes captured (13344 bits)
    Encapsulation type: NULL (15)
    Arrival Time: Mar 23, 2015 12:30:06.838585000 CET
    [Time shift for this packet: 0.000000000 seconds]
    Epoch Time: 1427110206.838585000 seconds
    [Time delta from previous captured frame: 0.000412000 seconds]
    [Time delta from previous displayed frame: 0.000412000 seconds]
    [Time since reference or first frame: 0.016086000 seconds]
    Frame Number: 9
    Frame Length: 1668 bytes (13344 bits)
    Capture Length: 1668 bytes (13344 bits)
    [Frame is marked: False]
    [Frame is ignored: False]
    [Protocols in frame: null:ipv6:ipv6.nxt:tcp:ssh]
Null/Loopback
    Family: IPv6 (30)
Internet Protocol Version 6, Src: ::1 (::1), Dst: ::1 (::1)
    0110 .... = Version: 6
        [0110 .... = This field makes the filter "ip.version == 6" possible: 6]
    .... 0000 0000 .... .... .... .... .... = Traffic class: 0x00000000
        .... 0000 00.. .... .... .... .... .... = Differentiated Services Field: Default (0x00000000)
        .... .... ..0. .... .... .... .... .... = ECN-Capable Transport (ECT): Not set
        .... .... ...0 .... .... .... .... .... = ECN-CE: Not set
    .... .... .... 0101 1101 0010 0011 0010 = Flowlabel: 0x0005d232
    Payload length: 1624
    Next header: TCP (6)
    Hop limit: 64
    Source: ::1 (::1)
    Destination: ::1 (::1)
    [Source GeoIP: Unknown]
    [Destination GeoIP: Unknown]
Transmission Control Protocol, Src Port: 61119 (61119), Dst Port: 22 (22), Seq: 22, Ack: 22, Len: 1592
    Source Port: 61119 (61119)
    Destination Port: 22 (22)
    [Stream index: 0]
    [TCP Segment Len: 1592]
    Sequence number: 22    (relative sequence number)
    [Next sequence number: 1614    (relative sequence number)]
    Acknowledgment number: 22    (relative ack number)
    Header Length: 32 bytes
    .... 0000 0001 1000 = Flags: 0x018 (PSH, ACK)
        000. .... .... = Reserved: Not set
        ...0 .... .... = Nonce: Not set
        .... 0... .... = Congestion Window Reduced (CWR): Not set
        .... .0.. .... = ECN-Echo: Not set
        .... ..0. .... = Urgent: Not set
        .... ...1 .... = Acknowledgment: Set
        .... .... 1... = Push: Set
        .... .... .0.. = Reset: Not set
        .... .... ..0. = Syn: Not set
        .... .... ...0 = Fin: Not set
    Window size value: 12743
    [Calculated window size: 407776]
    [Window size scaling factor: 32]
    Checksum: 0x0660 [validation disabled]
        [Good Checksum: False]
        [Bad Checksum: False]
    Urgent pointer: 0
    Options: (12 bytes), No-Operation (NOP), No-Operation (NOP), Timestamps
        No-Operation (NOP)
            Type: 1
                0... .... = Copy on fragmentation: No
                .00. .... = Class: Control (0)
                ...0 0001 = Number: No-Operation (NOP) (1)
        No-Operation (NOP)
            Type: 1
                0... .... = Copy on fragmentation: No
                .00. .... = Class: Control (0)
                ...0 0001 = Number: No-Operation (NOP) (1)
        Timestamps: TSval 195512263, TSecr 195512263
            Kind: Time Stamp Option (8)
            Length: 10
            Timestamp value: 195512263
            Timestamp echo reply: 195512263
    [SEQ/ACK analysis]
        [iRTT: 0.000113000 seconds]
        [Bytes in flight: 1592]
SSH Protocol
    SSH Version 2
        Packet Length: 1588
        Padding Length: 6
        Key Exchange
            Message Code: Key Exchange Init (20)
            Algorithms
                Cookie: 3c1b63c3b63178cf96c5d01b2ebb7d20
                kex_algorithms length: 126
                kex_algorithms string: diffie-hellman-group-exchange-sha256,diffie-hellman-group-exchange-sha1,diffie-hellman-group14-sha1,diffie-hellman-group1-sha1
                server_host_key_algorithms length: 131
                server_host_key_algorithms string: ssh-rsa-cert-v01@openssh.com,ssh-rsa-cert-v00@openssh.com,ssh-rsa,ssh-dss-cert-v01@openssh.com,ssh-dss-cert-v00@openssh.com,ssh-dss
                encryption_algorithms_client_to_server length: 203
                encryption_algorithms_client_to_server string [truncated]: aes128-ctr,aes192-ctr,aes256-ctr,arcfour256,arcfour128,aes128-gcm@openssh.com,aes256-gcm@openssh.com,aes128-cbc,3des-cbc,blowfish-cbc,cast128-cbc,aes192-cbc,aes256-cbc,arcfour,rijn
                encryption_algorithms_server_to_client length: 203
                encryption_algorithms_server_to_client string [truncated]: aes128-ctr,aes192-ctr,aes256-ctr,arcfour256,arcfour128,aes128-gcm@openssh.com,aes256-gcm@openssh.com,aes128-cbc,3des-cbc,blowfish-cbc,cast128-cbc,aes192-cbc,aes256-cbc,arcfour,rijn
                mac_algorithms_client_to_server length: 402
                mac_algorithms_client_to_server string [truncated]: hmac-md5-etm@openssh.com,hmac-sha1-etm@openssh.com,umac-64-etm@openssh.com,umac-128-etm@openssh.com,hmac-sha2-256-etm@openssh.com,hmac-sha2-512-etm@openssh.com,hmac-ripemd160-etm@openssh.
                mac_algorithms_server_to_client length: 402
                mac_algorithms_server_to_client string [truncated]: hmac-md5-etm@openssh.com,hmac-sha1-etm@openssh.com,umac-64-etm@openssh.com,umac-128-etm@openssh.com,hmac-sha2-256-etm@openssh.com,hmac-sha2-512-etm@openssh.com,hmac-ripemd160-etm@openssh.
                compression_algorithms_client_to_server length: 26
                compression_algorithms_client_to_server string: none,zlib@openssh.com,zlib
                compression_algorithms_server_to_client length: 26
                compression_algorithms_server_to_client string: none,zlib@openssh.com,zlib
                languages_client_to_server length: 0
                languages_client_to_server string: [Empty]
                languages_server_to_client length: 0
                languages_server_to_client string: [Empty]
                KEX First Packet Follows: 0
                Reserved: 00000000
            Payload: <MISSING>
            Padding String: 000000000000

Frame 10: 76 bytes on wire (608 bits), 76 bytes captured (608 bits)
    Encapsulation type: NULL (15)
    Arrival Time: Mar 23, 2015 12:30:06.838608000 CET
    [Time shift for this packet: 0.000000000 seconds]
    Epoch Time: 1427110206.838608000 seconds
    [Time delta from previous captured frame: 0.000023000 seconds]
    [Time delta from previous displayed frame: 0.000023000 seconds]
    [Time since reference or first frame: 0.016109000 seconds]
    Frame Number: 10
    Frame Length: 76 bytes (608 bits)
    Capture Length: 76 bytes (608 bits)
    [Frame is marked: False]
    [Frame is ignored: False]
    [Protocols in frame: null:ipv6:ipv6.nxt:tcp]
Null/Loopback
    Family: IPv6 (30)
Internet Protocol Version 6, Src: ::1 (::1), Dst: ::1 (::1)
    0110 .... = Version: 6
        [0110 .... = This field makes the filter "ip.version == 6" possible: 6]
    .... 0000 0000 .... .... .... .... .... = Traffic class: 0x00000000
        .... 0000 00.. .... .... .... .... .... = Differentiated Services Field: Default (0x00000000)
        .... .... ..0. .... .... .... .... .... = ECN-Capable Transport (ECT): Not set
        .... .... ...0 .... .... .... .... .... = ECN-CE: Not set
    .... .... .... 0111 1010 0101 0011 1101 = Flowlabel: 0x0007a53d
    Payload length: 32
    Next header: TCP (6)
    Hop limit: 64
    Source: ::1 (::1)
    Destination: ::1 (::1)
    [Source GeoIP: Unknown]
    [Destination GeoIP: Unknown]
Transmission Control Protocol, Src Port: 22 (22), Dst Port: 61119 (61119), Seq: 22, Ack: 1614, Len: 0
    Source Port: 22 (22)
    Destination Port: 61119 (61119)
    [Stream index: 0]
    [TCP Segment Len: 0]
    Sequence number: 22    (relative sequence number)
    Acknowledgment number: 1614    (relative ack number)
    Header Length: 32 bytes
    .... 0000 0001 0000 = Flags: 0x010 (ACK)
        000. .... .... = Reserved: Not set
        ...0 .... .... = Nonce: Not set
        .... 0... .... = Congestion Window Reduced (CWR): Not set
        .... .0.. .... = ECN-Echo: Not set
        .... ..0. .... = Urgent: Not set
        .... ...1 .... = Acknowledgment: Set
        .... .... 0... = Push: Not set
        .... .... .0.. = Reset: Not set
        .... .... ..0. = Syn: Not set
        .... .... ...0 = Fin: Not set
    Window size value: 12693
    [Calculated window size: 406176]
    [Window size scaling factor: 32]
    Checksum: 0x0028 [validation disabled]
        [Good Checksum: False]
        [Bad Checksum: False]
    Urgent pointer: 0
    Options: (12 bytes), No-Operation (NOP), No-Operation (NOP), Timestamps
        No-Operation (NOP)
            Type: 1
                0... .... = Copy on fragmentation: No
                .00. .... = Class: Control (0)
                ...0 0001 = Number: No-Operation (NOP) (1)
        No-Operation (NOP)
            Type: 1
                0... .... = Copy on fragmentation: No
                .00. .... = Class: Control (0)
                ...0 0001 = Number: No-Operation (NOP) (1)
        Timestamps: TSval 195512263, TSecr 195512263
            Kind: Time Stamp Option (8)
            Length: 10
            Timestamp value: 195512263
            Timestamp echo reply: 195512263
    [SEQ/ACK analysis]
        [This is an ACK to the segment in frame: 9]
        [The RTT to ACK the segment was: 0.000023000 seconds]
        [iRTT: 0.000113000 seconds]

Frame 11: 1540 bytes on wire (12320 bits), 1540 bytes captured (12320 bits)
    Encapsulation type: NULL (15)
    Arrival Time: Mar 23, 2015 12:30:06.841759000 CET
    [Time shift for this packet: 0.000000000 seconds]
    Epoch Time: 1427110206.841759000 seconds
    [Time delta from previous captured frame: 0.003151000 seconds]
    [Time delta from previous displayed frame: 0.003151000 seconds]
    [Time since reference or first frame: 0.019260000 seconds]
    Frame Number: 11
    Frame Length: 1540 bytes (12320 bits)
    Capture Length: 1540 bytes (12320 bits)
    [Frame is marked: False]
    [Frame is ignored: False]
    [Protocols in frame: null:ipv6:ipv6.nxt:tcp:ssh]
Null/Loopback
    Family: IPv6 (30)
Internet Protocol Version 6, Src: ::1 (::1), Dst: ::1 (::1)
    0110 .... = Version: 6
        [0110 .... = This field makes the filter "ip.version == 6" possible: 6]
    .... 0000 0000 .... .... .... .... .... = Traffic class: 0x00000000
        .... 0000 00.. .... .... .... .... .... = Differentiated Services Field: Default (0x00000000)
        .... .... ..0. .... .... .... .... .... = ECN-Capable Transport (ECT): Not set
        .... .... ...0 .... .... .... .... .... = ECN-CE: Not set
    .... .... .... 0111 1010 0101 0011 1101 = Flowlabel: 0x0007a53d
    Payload length: 1496
    Next header: TCP (6)
    Hop limit: 64
    Source: ::1 (::1)
    Destination: ::1 (::1)
    [Source GeoIP: Unknown]
    [Destination GeoIP: Unknown]
Transmission Control Protocol, Src Port: 22 (22), Dst Port: 61119 (61119), Seq: 22, Ack: 1614, Len: 1464
    Source Port: 22 (22)
    Destination Port: 61119 (61119)
    [Stream index: 0]
    [TCP Segment Len: 1464]
    Sequence number: 22    (relative sequence number)
